Title,Organization,Grant Amount,Deadline,Image URL
Applications Invited for India-UK PACT: Urban planning and mobility,UK PACT,500000 Pound,30 Nov. 2024,./grants/grant_logo/672ad93f7806c.png
Applications Invited for Countering Proliferator State Advanced Conventional Weapons Proliferation,Bureau of International Security-Nonproliferation,5000000 USD,17 Jan. 2025,./grants/grant_logo/67298cc847114.png
Applications Invited for Build Partner Capabilities to Counter Global Biological Threats,Bureau of International Security-Nonproliferation,5000000 USD,17 Jan. 2025,./grants/grant_logo/6728c4948d28f.png
Applications Invited for Build Partner Capabilities to Protect Critical Advanced and Emerging Technologies,Bureau of International Security-Nonproliferation,9000000 USD,17 Jan. 2025,./grants/grant_logo/6728c003ce9cb.png
Applications Invited for Digital Action Lab Initiative: Unleashing Tech for Democracy,CIVICUS,10000 USD,17 Nov. 2024,./grants/grant_logo/6721a074a287a.png
Applications Invited for ProVeg Grants,ProVeg International,50000 USD,01 Dec. 2024,./grants/grant_logo/671e8e9327383.png
Applications Invited for Level I Grants - Ocean Exploration and Discovery,National Geographic Society,20000 USD,14 Nov. 2024,./grants/grant_logo/671e86b69b50b.png
Applications Invited for Japan Fund for Global Environment Grants Program 2025,Japan Fund for Global Environment,Not specified,02 Dec. 2024,./grants/grant_logo/671e828166180.png
Applications Invited for the Van Tienhoven Foundation 2025 Project Round,Van Tienhoven Foundation,10000 Euro,31 Jan. 2025,./grants/grant_logo/671e7d39be01b.png
Applications Invited for Civil Society Organizations to expand women's leadership and political participation: WYDE| Women's Leadership,UN Women,150000 USD,11 Nov. 2024,./grants/grant_logo/6718fe77894a0.png
Applications Invited for Prime Minister Early Career Research Grant,Anusandhan National Research Foundation (ANRF),6000000 INR,19 Nov. 2024,./grants/grant_logo/6718f9a6230db.png
Applications Invited for Research Grants on Urban Climate Resilience,Global Disaster Preparedness Center (GDPC),10000 USD,12 Nov. 2024,./grants/grant_logo/6718f6222f875.png
Applications invited for ADB-IEA Innovative Policy Research Award 2025,Asian Development Bank (ADB),7000 USD,31 Dec. 2024,./grants/grant_logo/67170bcc27925.png
Applications Invited for Climate Futures: South Asia,British Council,15000 Pound,24 Nov. 2024,./grants/grant_logo/671076c595d6b.png
Applications Invited for Free Rivers Fund Regular Grants Program 2025,Free Rivers Fund,1000 Euro,10 Jan. 2025,./grants/grant_logo/6710743d26793.png
Applications Invited for ISF 11th Call for Proposals to Support for Climate Risk Insurance products,InsuResilience Solutions Fund (ISF),15000 Euro,13 Nov. 2024,./grants/grant_logo/670f28c9b4e73.png
Applications Invited for Landscape Restoration Grants,Endangered Landscapes & Seascapes Programme (ELSP),5000000 USD,14 Jan. 2025,./grants/grant_logo/670f229dc47b3.png
Applications Invited for the SNIS Grant,SNIS,348080 USD,22 Jan. 2025,./grants/grant_logo/670f1fb579207.png
Applications Invited for Action for Women's Health: A Global,Lever for Change,Not specified,03 Dec. 2024,./grants/grant_logo/670dd9e581108.png
Applications Invited for Assessing Changing Salinity in Water Sources,The Water Research Foundation (WRF),150000 USD,14 Nov. 2024,./grants/grant_logo/670dc1335f448.png
"Applications Invited for Understanding the Practices, Policies, and Impacts of System Development Fees and Upgrade Requirements",The Water Research Foundation (WRF),175000 USD,14 Nov. 2024,./grants/grant_logo/670d18572730b.png
Applications Invited for Mental Health and Well Being of Young People,Being,1500000 CAD,08 Jan. 2025,./grants/grant_logo/670c7ce68e17b.png
Applications Invited for International Trans Fund (ITF) Grant,International Trans Fund (ITF),50000 USD,02 Dec. 2024,./grants/grant_logo/670c79af9389e.png
Applications Invited for Asia Climate Solutions (ACS) Design Grant,Convergence,200000 USD,22 Nov. 2024,./grants/grant_logo/670892781f150.png
Applications Invited for ISF 11th Call for Proposals to Support for Climate Risk Insurance products,InsuResilience Solutions Fund (ISF),15000 Euro,13 Nov. 2024,./grants/grant_logo/67088db037107.png
Applications Invited for DRL Internet Freedom Annual Program Statement,"U.S Department of State, Bureau of Democracy Human Rights and Labor",3000000 USD,09 Jan. 2025,./grants/grant_logo/6705e1116943e.png
Applications Invited for AGCO Agriculture Foundation CAG 2024,AGCO Agriculture Foundation,450000 USD,29 Nov. 2024,./grants/grant_logo/6705dd688af27.png
Applications Invited for Recognizing Institutional and Organizational Capacity for Effective Workforce Development Programs,The Water Research Foundation (WRF),200000 USD,21 Nov. 2024,./grants/grant_logo/66fe0cea434f6.png
Applications Invited for the Foundations of Water Resource Planning: Guidance for Establishing Water Utility Service Levels (5306),The Water Research Foundation (WRF),175000 USD,21 Nov. 2024,./grants/grant_logo/66fe0404bc09b.png
"Applications Invited for Thinking Outside the Pipe: Comparison of Non-invasive, Non-destructive Condition Assessment Technologies for Distribution Pipe",The Water Research Foundation (WRF),250000 USD,21 Nov. 2024,./grants/grant_logo/66fe01ed5fd01.png
Applications Invited for the Liveability Challenge 2025,Eco-Business.,Not specified,09 Feb. 2025,./grants/grant_logo/66f379127b608.png
Applications Invited for the Ocean Stewardship Fund 2024-25,Marine Stewardship Council,50000 Pound,02 Dec. 2024,./grants/grant_logo/66e8e4e298aab.png
Applications Invited for 2025 Ockenden International Prize,Ockenden International,25000 GBP,30 Nov. 2024,./grants/grant_logo/66e2505a225c7.png
"Applications Invited for the Conservation, Food and Health Foundation Grant","The Conservation, Food and Health Foundation",50000 USD,01 Jan. 2025,./grants/grant_logo/66cf226b7e182.png
Applications Invited for Wildlife Acoustics grant Scientific Product Grant Program,Wildlife Acoustics,4000 USD,15 Nov. 2024,./grants/grant_logo/66ce8a72571ea.png
Applications Invited for Llama 3.1 Impact Grants,Meta,500000 USD,22 Nov. 2024,./grants/grant_logo/66b970ee12c2c.png
Applications Invited for Leakey Foundation Research Grants,Leakey Foundation,20000 USD,10 Jan. 2025,./grants/grant_logo/66b09f6b22bec.png
Applications Invited for Collaborative Research Action Tropical Forests: Global Implications and Pressing Actions (FORESTS 2024),Belmont Forum,Not specified,12 Nov. 2024,./grants/grant_logo/667e2a917a5fd.png
Applications Invited for WYDE Civic Engagement call for proposals – Third Round,ALDA – European Association for Local Democracy,Not specified,15 Jan. 2025,./grants/grant_logo/6678d5fe9e677.png
Applications Invited for TaroWorks Technology Grant,TaroWorks,20000 USD,On Rolling Basis,./grants/grant_logo/664ea7f02b206.png
Applications Invited for Innovative Health Practices,Agency for International Development,1000000000 USD,20 Feb. 2028,./grants/grant_logo/640f10ab75882.png
